symbol,title,summary,url,time_published,sentiment_score,source
NVDA,Prediction: The New Starbucks CEO Will Eventually Make This Big Move,He can take his experience from running other multinational restaurant chains to create value for Starbucks shareholders.,https://www.fool.com/investing/2024/08/25/prediction-the-new-starbucks-ceo-will-eventually-m/,20240825T230000,0.149975,Motley Fool
NVDA,Is It Too Late to Buy AMD Stock?,"AMD's stock has gained 107% since the launch of ChatGPT, lagging behind Super Micro and Nvidia but outperforming the S&P 500.",https://www.fool.com/investing/2024/08/25/is-it-too-late-to-buy-amd-stock/,20240825T171300,0.25055,Motley Fool
NVDA,2 Best Artificial Intelligence  ( AI )  Stocks to Buy Now: AI Chip Edition,Nvidia and Arm Holdings are the two best semiconductor stocks to buy for exposure to the fast-growing AI space.,https://www.fool.com/investing/2024/08/25/best-ai-stocks-to-buy-now-2024/,20240825T140000,0.27001,Motley Fool
NVDA,2 Game-Changing Artificial Intelligence  ( AI )  Stocks to Buy Now That Could Help Set You Up for Life,Here's how to claim your share of the AI gold rush.,https://www.fool.com/investing/2024/08/25/artificial-intelligence-ai-stocks-to-buy-now/,20240825T130500,0.272317,Motley Fool
NVDA,"Boston Dynamics' Atlas, Tesla's AI Edge, Amazon's Q AI Assistant, And More: This Week In Artificial Intelligence - Broadcom  ( NASDAQ:AVGO ) , Amazon.com  ( NASDAQ:AMZN ) ","As the week wraps up, the tech world has been buzzing with intriguing developments. From Boston Dynamics' humanoid robot, Atlas, showing off its warm-up routine to Tesla's AI prowess being hailed by Elon Musk's biographer, there's plenty to catch up on.",https://www.benzinga.com/news/24/08/40543436/boston-dynamics-atlas-teslas-ai-edge-amazons-q-ai-assistant-and-more-this-week-in-artificial-intelli,20240825T130022,0.357188,Benzinga
NVDA,Should You Get on the Nvidia Stock Bandwagon? 3 Motley Fool Contributors Weigh In,Nvidia's stock movement lately creates a conundrum. How you approach the stock could impact whether it makes you money.,https://www.fool.com/investing/2024/08/25/should-you-get-on-the-nvidia-stock-bandwagon-3-ana/,20240825T124500,0.029439,Motley Fool
NVDA,1 Warren Buffett Stock to Hedge Against an Overheated Market,Berkshire Hathaway is a compelling option in today's premium-laden market.,https://www.fool.com/investing/2024/08/25/1-warren-buffett-stock-to-hedge-against-an-overhea/,20240825T123000,0.279974,Motley Fool
NVDA,Prediction: 2 Growth Stocks That Will Be Worth More Than Microsoft in 5 Years,These companies have long growth histories and are consistently outperforming Microsoft.,https://www.fool.com/investing/2024/08/25/prediction-2-growth-stocks-that-will-be-worth-more/,20240825T103000,0.290775,Motley Fool
NVDA,Prediction: 2 Artificial Intelligence  ( AI )  Stocks That Will Join the $3 Trillion Club,These companies have delivered impressive gains thanks to AI and likely have much more to offer investors.,https://www.fool.com/investing/2024/08/25/prediction-2-artificial-intelligence-ai-stocks-tha/,20240825T101500,0.266495,Motley Fool
NVDA,3 Tech Stocks With More Potential Than Any Cryptocurrency,"AST SpaceMobile, Serve Robotics, and Lumen all have a lot of upside potential.",https://www.fool.com/investing/2024/08/25/tech-stocks-more-potential-than-cryptocurrency/,20240825T093500,0.07854,Motley Fool
NVDA,"1 Stock-Split ETF That Could Turn $500 Per Month Into $1 Million, With Nvidia's Help",This exchange-traded fund is beating the S&P 500 thanks to its high exposure to stocks like Nvidia.,https://www.fool.com/investing/2024/08/25/1-stock-split-etf-turn-500-month-1-million-nvidia/,20240825T092700,0.253998,Motley Fool
NVDA,AMD Just Made a Game-Changing Move. Here's What You Need to Know,The chip company accelerated its acquisition strategy with its purchase of ZT Systems.,https://www.fool.com/investing/2024/08/25/amd-just-made-a-game-changing-move-heres-what-you/,20240825T090200,0.157644,Motley Fool
NVDA,"Prediction: Nvidia Will Deliver Record Results on Aug. 28, Which Will Supercharge the Stock",Uncertainty has weighed on Nvidia stock in recent weeks. That could all change on Wednesday.,https://www.fool.com/investing/2024/08/25/prediction-nvidia-will-deliver-record-results-on-a/,20240825T090100,0.207401,Motley Fool
NVDA,3 ETFs for Growth Investors to Buy and Hold for Decades,These exchange-traded funds can help you easily tap into some promising growth opportunities.,https://www.fool.com/investing/2024/08/25/3-etfs-for-growth-investors-to-buy-and-hold-for-de/,20240825T085700,0.393446,Motley Fool
NVDA,"3 Stocks That Could Turn $1,000 Into $5,000 by 2030",It's going to take something special to outgrow the economy and competitors over the course of the coming six years. These companies have it.,https://www.fool.com/investing/2024/08/25/3-stocks-that-could-turn-1000-into-5000-by-2030/,20240825T075500,0.275327,Motley Fool
NVDA,Missed Out on Nvidia? Buy Taiwan Semiconductor Instead.,TSMC looks poised to be a big AI infrastructure winner.,https://www.fool.com/investing/2024/08/25/missed-out-on-nvidia-buy-taiwan-semiconductor/,20240825T075100,0.287425,Motley Fool
NVDA,Nvidia Stock: Time to Sell?,Shares of the chip company have surged about 25% from recent lows.,https://www.fool.com/investing/2024/08/25/nvidia-stock-time-to-sell/,20240825T071500,0.143903,Motley Fool
NVDA,Prediction: The Stock Market Will Go Up No Matter Who Wins the 2024 Election,The president's impact on the economy is generally exaggerated.,https://www.fool.com/investing/2024/08/24/prediction-the-stock-market-will-go-up-election/,20240824T210000,0.074236,Motley Fool
NVDA,Wall Street Analysts Are Bearish on This Artificial Intelligence  ( AI )  Stock. Here's Why I'm Not.,"Upstart has fallen out of favor with investors, but there are signs a turnaround is emerging.",https://www.fool.com/investing/2024/08/24/wall-street-analysts-are-bearish-on-this-artificia/,20240824T204000,0.111706,Motley Fool
NVDA,"ROSEN, RECOGNIZED INVESTOR COUNSEL, Encourages Vicor Corporation Investors to Secure Counsel Before Important Deadline in Securities Class Action - VICR - Vicor  ( NASDAQ:VICR ) ","NEW YORK, Aug. 24, 2024 ( GLOBE NEWSWIRE ) -- WHY: Rosen Law Firm, a global investor rights law firm, reminds purchasers of common stock of Vicor Corporation VICR between April 26, 2023 and February 22, 2024, both dates inclusive ( the ""Class Period"" ) , of the important September 23, 2024 ...",https://www.benzinga.com/pressreleases/24/08/g40541715/rosen-recognized-investor-counsel-encourages-vicor-corporation-investors-to-secure-counsel-before-,20240824T180000,0.169047,Benzinga
NVDA,Big tech is prepping an explosive pivot to robotics,The ten most valuable tech firms in the world are all involved in developing technology for the robotics industry.,https://cointelegraph.com/news/big-tech-ai-prepping-explosive-pivot-robotics-robots,20240824T172733,0.054524,Cointelegraph
NVDA,Forget the Dow Jones -- Buy This Magnificent ETF Instead,This ETF is head and shoulders above the Dow Jones.,https://www.fool.com/investing/2024/08/24/forget-the-dow-jones-buy-this-magnificent-etf-inst/,20240824T151000,0.205952,Motley Fool
NVDA,"Meet the Supercharged Growth Stock That Could Join Apple, Microsoft, and Nvidia in the $3 Trillion Club by 2031",Strong growth and secular tailwinds should help drive this tech titan to new heights.,https://www.fool.com/investing/2024/08/24/meet-the-supercharged-growth-stock-that-could-join/,20240824T150500,0.33212,Motley Fool
NVDA,Intel Stock Was Added To Dow Jones Index In 1999 - Here's How The Stock Has Performed Since - Intel  ( NASDAQ:INTC ) ,Chipmaker Intel Corporation INTC has had a rough couple of years with the stock underperforming the technology sector and major stock market indexes. The stock has also underperformed since it joined the Dow Jones Industrial Average a quarter-century ago.,https://www.benzinga.com/general/education/24/08/40541392/intel-stock-was-added-to-dow-jones-index-in-1999-heres-how-the-stock-has-performed-since,20240824T150018,0.13232,Benzinga
NVDA,"2 ""Magnificent Seven"" Stocks That Could Create Lasting Generational Wealth",These technology titans are compelling picks at current price levels.,https://www.fool.com/investing/2024/08/24/2-magnificent-seven-stocks-that-can-create-wealth/,20240824T144100,0.282904,Motley Fool
NVDA,Super Micro Computer Announced a Stock Split. But There's an Even Better Reason to Buy Right Now.,Supermicro's stock has mismatched expectations.,https://www.fool.com/investing/2024/08/24/super-micro-computer-announced-a-stock-split-but/,20240824T141500,0.257151,Motley Fool
NVDA,Is the VanEck Semiconductor ETF Still a Millionaire Maker?,Investors will be hard pressed to find an ETF with a better performance history.,https://www.fool.com/investing/2024/08/24/is-the-vaneck-semiconductor-etf-a-millionaire-make/,20240824T130500,0.180958,Motley Fool
NVDA,1 Artificial Intelligence  ( AI )  Stock to Buy Right Now Before It Soars,This company expects AI to drive a substantial increase in its addressable market in the long run.,https://www.fool.com/investing/2024/08/24/1-artificial-intelligence-stock-to-buy-right-now/,20240824T121500,0.373701,Motley Fool
NVDA,AMD's Leapfrog Moment Has Arrived. Here's Why Now May Be a Once-in-a-Lifetime Opportunity to Buy the Stock.,Nvidia's new Blackwell chips are delayed due to a design flaw.,https://www.fool.com/investing/2024/08/24/amds-leapfrog-moment-has-arrived-heres-why-now-may/,20240824T114500,0.115938,Motley Fool
NVDA,Does SoundHound AI's Impressive Revenue Growth Make Up for Its Rising Losses?,"SoundHound AI's growth rate could accelerate next year thanks to a key acquisition, but is that enough to make the stock a buy?",https://www.fool.com/investing/2024/08/24/does-soundhound-ais-impressive-revenue-growth-make/,20240824T103000,0.271021,Motley Fool
NVDA,Prediction: These Will Be the Best-Performing S&P 500 Stocks of 2024,The S&P 500's top three at year-end could look a little different than they do now.,https://www.fool.com/investing/2024/08/24/prediction-best-performing-sp-500-stocks-2024/,20240824T095000,0.252363,Motley Fool
NVDA,Nvidia's Stock Has Soared 30% Since It Announced Its 10-for-1 Stock Split. History Says This Will Happen Next.,"In the 12-month periods after the chipmaker's previous stock splits, its share price has, on average, fallen sharply.",https://www.fool.com/investing/2024/08/24/nvidia-stock-soared-30-since-stock-split-this-next/,20240824T091200,0.113736,Motley Fool
NVDA,"Prediction: On Aug. 28, This Figure From Nvidia Will Confirm an Artificial Intelligence  ( AI )  Bubble That's in the Early Stages of Bursting",This all-important metric is likely to signal that the euphoria surrounding artificial intelligence (AI) is beginning to fade.,https://www.fool.com/investing/2024/08/24/prediction-aug-28-nvidia-confirm-ai-bubble-burst/,20240824T084100,0.124701,Motley Fool
NVDA,"Warren Buffett Issued a $277 Billion ""Warning"" for the Stock Market. Investors May Want to Ignore It  ( Mostly ) .","Berkshire Hathaway has accumulated a tremendous amount of liquid capital on its balance sheet, which hints at an overvalued stock market.",https://www.fool.com/investing/2024/08/24/warren-buffett-277-billion-warning-on-stock-market/,20240824T080500,0.048414,Motley Fool
NVDA,Prediction: 2 Stocks That'll Be Worth More Than Apple 10 Years From Now,"Catching Apple won't be easy, but these two titans could get there.",https://www.fool.com/investing/2024/08/24/prediction-2-stocks-thatll-be-worth-more-than-appl/,20240824T075900,0.238981,Motley Fool
NVDA,Prediction: These 2 Dividend-Paying Stocks Will Outperform the Market This Decade,Investors are underrating the durability of these high-yielding stocks.,https://www.fool.com/investing/2024/08/24/prediction-these-2-dividend-paying-stocks-will-out/,20240824T073900,0.204235,Motley Fool
NVDA,A Bull Market Is Here: 2 Artificial Intelligence  ( AI )  Stocks Down 18% and 41% to Buy Right Now,Looking for ways to profit from the rise of AI? These companies are poised to win big with the technology.,https://www.fool.com/investing/2024/08/24/bull-market-is-here-2-ai-stocks-buy-pltr-trmb/,20240824T073500,0.376555,Motley Fool
NVDA,"3 Stock-Split Stocks to Buy Before They Soar as Much as 148%, According to Select Wall Street Analysts",Data shows that stock-split stocks tend to continue their track record of outperformance.,https://www.fool.com/investing/2024/08/24/3-stock-split-stocks-to-buy-hand-over-fist-before/,20240824T071000,0.264484,Motley Fool
NVDA,"AI Could Make Coders Obsolete in Two Years, AWS Chief Predicts",Amazon Web Services CEO Matt Garman is not the first to envision AI doing the bulk of software development.,https://decrypt.co/246216/ai-could-make-coders-obsolete-in-two-years-aws-chief-predicts,20240823T222143,0.101648,Decrypt.co
NVDA,A Closer Look at Retail and Nvidia Earnings,"Nvidia has established itself as a true leader of the coming artificial intelligence (AI) economy, with its next set of results scheduled to come after the market's close on Wednesday, August 28th. What can investors expect?",https://www.zacks.com/commentary/2326646/a-closer-look-at-retail-and-nvidia-earnings,20240823T221200,0.078042,Zacks Commentary
NVDA,VICR INVESTOR ALERT: Kirby McInerney LLP Reminds Vicor Corporation Investors of Upcoming Lead Plaintiff Deadline in Class Action Lawsuit - Vicor  ( NASDAQ:VICR ) ,"NEW YORK, Aug. 23, 2024 ( GLOBE NEWSWIRE ) -- The law firm of Kirby McInerney LLP reminds investors of the September 23, 2024 deadline to seek the role of lead plaintiff in a federal securities class action that has been filed on behalf of those who acquired Vicor Corporation, Inc. ( ""Vicor"" or ...",https://www.benzinga.com/pressreleases/24/08/g40537818/vicr-investor-alert-kirby-mcinerney-llp-reminds-vicor-corporation-investors-of-upcoming-lead-plain,20240823T213900,0.09868,Benzinga
NVDA,Should You Buy Super Micro Computer Before the Stock Split?,The AI stock is on sale. Is it a buy?,https://www.fool.com/investing/2024/08/23/should-you-buy-super-micro-computer-before-its-oct/,20240823T211500,0.226469,Motley Fool
NVDA,"Why Nvidia, Arm Holdings, Broadcom, and Other Artificial Intelligence  ( AI )  Stocks Rallied on Friday",The Federal Reserve Bank is finally saying what Wall Street has been waiting to hear.,https://www.fool.com/investing/2024/08/23/why-nvidia-arm-holdings-broadcom-and-other-artific/,20240823T203229,0.150309,Motley Fool
NVDA,Nvidia Jumped Today -- Is the AI Stock a Buy Ahead of Its Big Q2 Release on Aug. 28?,"Nvidia stock has soared 161% this year, and now it's on the verge of a massive test.",https://www.fool.com/investing/2024/08/23/nvidia-jumped-today-is-the-ai-stock-a-buy-ahead-of/,20240823T203055,0.235578,Motley Fool
NVDA,"Nvidia Is Next Week's Top Stock, Market Strategist Says: Why Best Long-Term Idea Is 'Just Buy Nvidia And Put It Away' - NVIDIA  ( NASDAQ:NVDA ) ","An earnings report from NVIDIA Corporation NVDA will be closely watched by investors and could be a market-leading indicator, a market strategist tells Benzinga ahead of the results coming Aug. 28 after market close.",https://www.benzinga.com/top-stories/24/08/40534794/nvidia-is-next-weeks-top-stock-market-strategist-says-why-best-long-term-idea-is-just-buy-nvidia-and,20240823T185928,0.170964,Benzinga
NVDA,Analysts come unglued ahead of Nvidia earnings call - $10 trillion within 5 years,The September 28 earnings report is being called the most important event of the year for the stock market.,https://cointelegraph.com/news/analysts-come-unglued-ahead-ai-nvidia-earnings-call-10-trillion-within-5-years,20240823T185459,0.061222,Cointelegraph
NVDA,Is Taiwan Semiconductor  ( TSM )  a Must-Buy on 29.6% Rise in 6 Months?,Taiwan Semiconductor (TSM) is riding on its strong portfolio of advanced technologies in the semiconductor industry.,https://www.zacks.com/stock/news/2326610/is-taiwan-semiconductor-tsm-a-must-buy-on-296-rise-in-6-months,20240823T170500,0.373273,Zacks Commentary
NVDA,Why Intel Stock Is Climbing Today,Is the Federal Reserve about to give Intel a much-needed helping hand?,https://www.fool.com/investing/2024/08/23/why-intel-stock-is-climbing-today/,20240823T165555,0.197179,Motley Fool
NVDA,Smart Money Is Betting Big In TSM Options - Taiwan Semiconductor  ( NYSE:TSM ) ,"Financial giants have made a conspicuous bullish move on Taiwan Semiconductor. Our analysis of options history for Taiwan Semiconductor TSM revealed 44 unusual trades. Delving into the details, we found 54% of traders were bullish, while 34% showed bearish tendencies.",https://www.benzinga.com/insights/options/24/08/40532544/smart-money-is-betting-big-in-tsm-options,20240823T164642,0.302172,Benzinga
NVDA,Strong Economy Doesn't 'Justify' 4 Rate Cuts This Year: How About 3? What Experts Are Saying,"The economy is too strong to ""justify"" four interest rate cuts getting priced in by year-end, according to Apollo Global Management's Torsten Slok.",https://www.benzinga.com/news/24/08/40532443/strong-economy-doesnt-justify-4-rate-cuts-this-year-how-about-3-what-experts-are-saying,20240823T164403,0.060988,Benzinga
